{
  "id": "extension-chain-3x3",
  "title": "The Parity Gallery",
  "size": 3,
  "cards": [
    {"cell":"A1","name":"Aria","profession":"Analyst","status":"CRIMINAL","initially_revealed":true,"clue":{"id":"E3-01","type":"FACT","target":"B1","status":"CRIMINAL"}},
    {"cell":"B1","name":"Basil","profession":"Biologist","status":"CRIMINAL","initially_revealed":false,"clue":{"id":"E3-02","type":"IMPLIES","characters":["B1","C1"]}},
    {"cell":"C1","name":"Cleo","profession":"Chemist","status":"CRIMINAL","initially_revealed":false,"clue":{"id":"E3-03","type":"ODD","region":{"type":"EXPLICIT","cells":["C1","A2"]}}},
    {"cell":"A2","name":"Dara","profession":"Designer","status":"INNOCENT","initially_revealed":false,"clue":{"id":"E3-04","type":"DIFFERENT","characters":["A2","B2"]}},
    {"cell":"B2","name":"Eli","profession":"Engineer","status":"CRIMINAL","initially_revealed":false,"clue":{"id":"E3-05","type":"SAME","characters":["B2","C2"]}},
    {"cell":"C2","name":"Faye","profession":"Farmer","status":"CRIMINAL","initially_revealed":false,"clue":{"id":"E3-06","type":"FACT","target":"A3","status":"INNOCENT"}},
    {"cell":"A3","name":"Galen","profession":"Geologist","status":"INNOCENT","initially_revealed":false,"clue":{"id":"E3-07","type":"DIFFERENT","characters":["A3","B3"]}},
    {"cell":"B3","name":"Hana","profession":"Historian","status":"CRIMINAL","initially_revealed":false,"clue":{"id":"E3-08","type":"DIFFERENT","characters":["B3","C3"]}},
    {"cell":"C3","name":"Ivan","profession":"Illustrator","status":"INNOCENT","initially_revealed":false,"clue":{"id":"E3-09","type":"FACT","target":"A1","status":"CRIMINAL"}}
  ]
}
