{
  "id": "extension-chain-4x4",
  "title": "The Implication Archive",
  "size": 4,
  "cards": [
    {"cell":"A1","name":"Amber","profession":"Archivist","status":"CRIMINAL","initially_revealed":true,"clue":{"id":"E4-01","type":"FACT","target":"B1","status":"CRIMINAL"}},
    {"cell":"B1","name":"Bruno","profession":"Botanist","status":"CRIMINAL","initially_revealed":false,"clue":{"id":"E4-02","type":"IMPLIES","characters":["B1","C1"]}},
    {"cell":"C1","name":"Cyra","profession":"Curator","status":"CRIMINAL","initially_revealed":false,"clue":{"id":"E4-03","type":"ODD","region":{"type":"EXPLICIT","cells":["C1","D1"]}}},
    {"cell":"D1","name":"Dorian","profession":"Dentist","status":"INNOCENT","initially_revealed":false,"clue":{"id":"E4-04","type":"DIFFERENT","characters":["D1","A2"]}},
    {"cell":"A2","name":"Esme","profession":"Engineer","status":"CRIMINAL","initially_revealed":false,"clue":{"id":"E4-05","type":"SAME","characters":["A2","B2"]}},
    {"cell":"B2","name":"Felix","profession":"Farmer","status":"CRIMINAL","initially_revealed":false,"clue":{"id":"E4-06","type":"FACT","target":"C2","status":"INNOCENT"}},
    {"cell":"C2","name":"Greta","profession":"Guide","status":"INNOCENT","initially_revealed":false,"clue":{"id":"E4-07","type":"FACT","target":"D2","status":"CRIMINAL"}},
    {"cell":"D2","name":"Hector","profession":"Historian","status":"CRIMINAL","initially_revealed":false,"clue":{"id":"E4-08","type":"FACT","target":"A3","status":"INNOCENT"}},
    {"cell":"A3","name":"Ines","profession":"Inspector","status":"INNOCENT","initially_revealed":false,"clue":{"id":"E4-09","type":"FACT","target":"B3","status":"CRIMINAL"}},
    {"cell":"B3","name":"Jonas","profession":"Jeweler","status":"CRIMINAL","initially_revealed":false,"clue":{"id":"E4-10","type":"FACT","target":"C3","status":"INNOCENT"}},
    {"cell":"C3","name":"Kira","profession":"Keeper","status":"INNOCENT","initially_revealed":false,"clue":{"id":"E4-11","type":"FACT","target":"D3","status":"CRIMINAL"}},
    {"cell":"D3","name":"Luc","profession":"Librarian","status":"CRIMINAL","initially_revealed":false,"clue":{"id":"E4-12","type":"FACT","target":"A4","status":"INNOCENT"}},
    {"cell":"A4","name":"Mira","profession":"Musician","status":"INNOCENT","initially_revealed":false,"clue":{"id":"E4-13","type":"FACT","target":"B4","status":"CRIMINAL"}},
    {"cell":"B4","name":"Nico","profession":"Nurse","status":"CRIMINAL","initially_revealed":false,"clue":{"id":"E4-14","type":"FACT","target":"C4","status":"INNOCENT"}},
    {"cell":"C4","name":"Opal","profession":"Optician","status":"INNOCENT","initially_revealed":false,"clue":{"id":"E4-15","type":"FACT","target":"D4","status":"CRIMINAL"}},
    {"cell":"D4","name":"Pavel","profession":"Pilot","status":"CRIMINAL","initially_revealed":false,"clue":{"id":"E4-16","type":"FACT","target":"A1","status":"CRIMINAL"}}
  ]
}
