{
  "id": "standard-deduction-3x3",
  "title": "The Atrium Ledger",
  "size": 3,
  "cards": [
    {"cell":"A1","name":"Alden","profession":"Auditor","status":"CRIMINAL","initially_revealed":true,"clue":{"id":"S3-01","type":"EXACTLY","k":2,"region":{"type":"ROW","index":1},"text":"Exactly two people in Row 1 are Criminal."}},
    {"cell":"B1","name":"Bria","profession":"Bookbinder","status":"CRIMINAL","initially_revealed":false,"clue":{"id":"S3-02","type":"SAME","characters":["C2","A1"],"text":"C2 and A1 have the same status."}},
    {"cell":"C1","name":"Corin","profession":"Cartographer","status":"INNOCENT","initially_revealed":true,"clue":{"id":"S3-03","type":"AT_LEAST","k":2,"region":{"type":"COLUMN","index":1},"text":"At least two people in Column A are Criminal."}},
    {"cell":"A2","name":"Delia","profession":"Diplomat","status":"CRIMINAL","initially_revealed":false,"clue":{"id":"S3-04","type":"SAME","characters":["C3","A2"],"text":"C3 and A2 have the same status."}},
    {"cell":"B2","name":"Emil","profession":"Editor","status":"INNOCENT","initially_revealed":false,"clue":{"id":"S3-05","type":"SAME","characters":["B3","B2"],"text":"B3 and B2 have the same status."}},
    {"cell":"C2","name":"Fara","profession":"Forensic Artist","status":"CRIMINAL","initially_revealed":false,"clue":{"id":"S3-06","type":"DIFFERENT","characters":["A3","C1"],"text":"A3 and C1 have different statuses."}},
    {"cell":"A3","name":"Gavin","profession":"Geometer","status":"CRIMINAL","initially_revealed":false,"clue":{"id":"S3-07","type":"SAME","characters":["A2","A3"],"text":"A2 and A3 have the same status."}},
    {"cell":"B3","name":"Helena","profession":"Historian","status":"INNOCENT","initially_revealed":false,"clue":{"id":"S3-08","type":"EXACTLY","k":2,"region":{"type":"ROW","index":3},"text":"Exactly two people in Row 3 are Criminal."}},
    {"cell":"C3","name":"Idris","profession":"Illustrator","status":"CRIMINAL","initially_revealed":false,"clue":{"id":"S3-09","type":"DIFFERENT","characters":["B2","C3"],"text":"B2 and C3 have different statuses."}}
  ]
}
